<?xml version="1.0" encoding="utf-8" standalone="no" ?>

<!DOCTYPE cuenta SYSTEM "LMSGI-E01-Email-DTD.dtd" >

<!-- Ejemplar: cuenta -->

<cuenta codigoCuenta="123" >
	<descripcion>micuenta@gmail.com</descripcion>

	<!-- Detalle de cada email.
		Es conveniente es hacer al menos dos para comprobar que la validación de la cardinalidad funciona bien.
		Para probar la opcionalidad del atributo prioridad, os recomiendo hacer un email con ese atributo y otro sin él
		Lo mismo se puede aplicar al resto de elementos opcionales
	-->

	<email prioridad ="alta">
		<informacion codigoEmail="222" leido ="si" >
			<categorizar>FAMILIA</categorizar>
		</informacion>

		<cabecera>
			<fechaHora>
				<dia>12</dia>
				<mes>12</mes>
				<anho>12</anho>
				<hora>12</hora>
				<minuto>12</minuto>
				<segundo>12</segundo>
			</fechaHora>

			<remitente>
				<nombre>Juana Pérez</nombre>
				<correo>calamidad@gmail.com</correo>
			</remitente>

			<destinatarios>
				<destinatario>
					<nombre>Jose López</nombre>
					<correo>pepito@gmail.com</correo>
					<tipo>Para</tipo>
				</destinatario>

				<destinatario>
					<!-- Compruebo que el nombre es opcional no poniendole
						<nombre>Jaime López</nombre>
					-->
					<correo>jaimito@gmail.com</correo>
					<tipo>CC</tipo>
				</destinatario>
			</destinatarios>
		</cabecera>

		<mensaje>Hola, ¿qué tal?</mensaje>
	</email>

	<email>
		<informacion codigoEmail="333" leido ="no" >
			<categorizar>FAMILIA</categorizar>
		</informacion>

		<cabecera>
			<fechaHora>
				<dia>12</dia>
				<mes>12</mes>
				<anho>12</anho>
				<hora>12</hora>
				<minuto>15</minuto>
				<segundo>28</segundo>
			</fechaHora>

			<remitente>
				<correo>calamidad@gmail.com</correo>
			</remitente>

			<destinatarios>
				<destinatario>
					<nombre>Jose López</nombre>
					<correo>pepito@gmail.com</correo>
					<tipo>Para</tipo>
				</destinatario>

				<destinatario>
					
					<!-- Compruebo que el nombre es opcional no poniendole
						<nombre>Jaime López</nombre>
					-->
					<correo>jaimito@gmail.com</correo>
					<tipo>CC</tipo>
				</destinatario>
			</destinatarios>
		</cabecera>

		<mensaje>Bien, ¿quedamos?</mensaje>
	</email>

</cuenta>